Answer Page,Metric,Company,Year,Value,Source Page,Answer ID,Original Source,Source Count,Comments,ISIN
https://wikirate.org/~6947506,"Research Group Eticonsum+Goal of elimination of ""cage eggs"" in 2025",Mercadona,2020,Yes,https://wikirate.org/~6946530,6947506,https://info.mercadona.es/es/actualidad/esta-es-la-politica-de-bienestar-animal-de-mercadona/news,1,"En sus informes de 2019 solo encontramos la siguiente declaración : ""Mercadona está trabajando con sus proveedores para abandonar progresivamente la venta de huevo procedente de gallinas en jaula."" No obstante, no observamos ningún compromiso temporal. Las declaraciones más concretas en este sentido las hemos encontrados en varios artículos en internet en los cuales la cadena anuncia que ""venderá todos los huevos de gallinas criadas fuera de jaula en 2023."" Luis Leyton[https://wikirate.org/Luis_Leyton].....2021-02-25 21:57:46 UTC",US58733R1023;US58733R2013;US58733RAC60;US58733RAD44;US58733RAE27;US58733RAF91
https://wikirate.org/~6947516,"Research Group Eticonsum+Elimination of own brand ""cage eggs"" in 2023",Mercadona,2020,Yes,https://wikirate.org/~6946530,6947516,https://info.mercadona.es/es/actualidad/esta-es-la-politica-de-bienestar-animal-de-mercadona/news,1,"En sus informes de 2019 solo encontramos la siguiente declaración : ""Mercadona está trabajando con sus proveedores para abandonar progresivamente la venta de huevo procedente de gallinas en jaula."" No obstante, no observamos ningún compromiso temporal. Las declaraciones más concretas en este sentido las hemos encontrados en varios artículos en internet en los cuales la cadena anuncia que ""venderá todos los huevos de gallinas criadas fuera de jaula en 2023."" Luis Leyton[https://wikirate.org/Luis_Leyton].....2021-02-25 21:57:47 UTC",US58733R1023;US58733R2013;US58733RAC60;US58733RAD44;US58733RAE27;US58733RAF91
https://wikirate.org/~6947546,Research Group Eticonsum+Own range of vegetarian or vegan products,Mercadona,2020,Yes,https://wikirate.org/~6946530,6947546,https://info.mercadona.es/es/actualidad/esta-es-la-politica-de-bienestar-animal-de-mercadona/news,1,Hemos podido comprobar al menos 3 referencias de embutidos veggies marca propia en su tienda online y en la plataforma de Openfoodfact (https://es.openfoodfacts.org/) Luis Leyton[https://wikirate.org/Luis_Leyton].....2021-02-25 21:57:49 UTC,US58733R1023;US58733R2013;US58733RAC60;US58733RAD44;US58733RAE27;US58733RAF91
https://wikirate.org/~6957676,Research Group Eticonsum+Animal welfare requirements in some products and species,Grupo Eroski,2020,Yes,https://wikirate.org/~6948500,6957676,https://www.eroski.es/bienestar-animal/,1,"En 2019 Eroski declara que ""ha incorporado una nueva certificación en Bienestar Animal WelfairTM a su carne de cerdo, pollo y ternasco de Aragón EROSKI Natur, con estrictos estándares en principios de Animal Welfare como la alimentación, el alojamiento, la salud y el comportamiento natural. Además, según informa la compañía, ""su pollo EROSKI Natur cumple con todos los requisitos del European Chicken Commitment, que incluye requisitos en cuanto a especies, características del alojamiento y sacrificio."" La cadena cuenta con 490 productos EROSKI NATUR, que incluyen certificaciones como Global G.A.P., de producción integrada o de bienestar animal. Luis Leyton[https://wikirate.org/Luis_Leyton].....2021-02-27 21:00:30 UTC",
https://wikirate.org/~6957681,Research Group Eticonsum+Responsible use of antibiotics,Grupo Eroski,2020,Yes,https://wikirate.org/~6948500,6957681,https://www.eroski.es/bienestar-animal/,1,"Eroski comunica que ""es uno de los distribuidores pioneros en certificar el bienestar animal en cárnicos, así como en fomentar programas de reducción de antibióticos durante la cría de los animales destinados a consumo humano. Según declara la compañía ""trabajan en un plan de eliminación y reducción de antibióticos en los productos EROSKI Natur, ya que son conscientes de que la resistencia a los antibióticos crece en Europa debido a su uso desmedido en el proceso de cría de los animales"". Luis Leyton[https://wikirate.org/Luis_Leyton].....2021-02-27 21:00:31 UTC",
https://wikirate.org/~6957701,"Research Group Eticonsum+Goal of elimination of ""cage eggs"" in 2025",Grupo Eroski,2020,Yes,https://wikirate.org/~6948500,6957701,https://www.eroski.es/bienestar-animal/,1,"En 2019 Eroski comunica que ""el volumen de huevos de gallinas criadas en suelo que comercializan en sus tiendas ya supone alrededor del 45 % de sus ventas. Por otra parte, ""la compañía se compromete a que este porcentaje alcance el 100 % de los huevos comercializados en toda la red de tiendas en 2024"". Luis Leyton[https://wikirate.org/Luis_Leyton].....2021-02-27 21:00:33 UTC",
https://wikirate.org/~6957706,"Research Group Eticonsum+Elimination of own brand ""cage eggs""",Grupo Eroski,2020,Yes,https://wikirate.org/~6948500,6957706,https://www.eroski.es/bienestar-animal/,1,"En 2019 Eroski comunica que ""el volumen de huevos de gallinas criadas en suelo que comercializan en sus tiendas ya supone alrededor del 45 % de sus ventas. Pero no especifica si ninguno de los huevos de marca propia son de categoria 3 Luis Leyton[https://wikirate.org/Luis_Leyton].....2021-02-27 21:00:34 UTC",
https://wikirate.org/~6957711,"Research Group Eticonsum+Elimination of own brand ""cage eggs"" in 2023",Grupo Eroski,2020,Yes,https://wikirate.org/~6948500,6957711,https://www.eroski.es/bienestar-animal/,1,"En 2019 Eroski comunica que ""el volumen de huevos de gallinas criadas en suelo que comercializan en sus tiendas ya supone alrededor del 45 % de sus ventas. Por otra parte, ""la compañía se compromete a que este porcentaje alcance el 100 % de los huevos comercializados en toda la red de tiendas en 2024"". Luis Leyton[https://wikirate.org/Luis_Leyton].....2021-02-27 21:00:35 UTC",
https://wikirate.org/~6952004,"Research Group Eticonsum+Goal of elimination of ""cage eggs"" in 2025",Distribuidora Internacional de Alimentacion SA (DIA),2020,Yes,https://wikirate.org/~6949072,6952004,,1,"La compañía declara un compromiso firme y concreto en esta materia : ""Como parte de la nueva estrategia global de sostenibilidad que GRUPO DIA está definiendo, la compañía se ha comprometido a vender en sus establecimientos de España, a partir de 2022, exclusivamente aquellos huevos que procedan de sistemas libres de jaula. "" Luis Leyton[https://wikirate.org/Luis_Leyton].....2021-02-27 20:50:18 UTC",
https://wikirate.org/~6952014,"Research Group Eticonsum+Elimination of own brand ""cage eggs"" in 2023",Distribuidora Internacional de Alimentacion SA (DIA),2020,Yes,https://wikirate.org/~6949072,6952014,,1,"La compañía declara un compromiso firme y concreto en esta materia : ""Como parte de la nueva estrategia global de sostenibilidad que GRUPO DIA está definiendo, la compañía se ha comprometido a vender en sus establecimientos de España, a partir de 2022, exclusivamente aquellos huevos que procedan de sistemas libres de jaula. "" Luis Leyton[https://wikirate.org/Luis_Leyton].....2021-02-27 20:50:19 UTC",
https://wikirate.org/~6959555,Research Group Eticonsum+Policy on Animal Welfare,Alcampo S.A.,2020,Yes,https://wikirate.org/~6948566,6959555,https://www.alcampocorporativo.es/wp-content/uploads/sites/7/2019/09/POLITICA_BIENESTAR-ANIMAL_0920.pdf,1,"A través de su último informe de actividad y RSC 2019 podemos acceder a un ink con el Informe de Bienesar Animal de Auchan que incluye objetivos muy concretos con plazos no mas allá de 2025. Estos compromisos van desde la no comercialización de huevos de gallinas enjauladas de marca propia (en 2021) y de todos sus proveedores (en 2025), hasta las exigencias de requisitos de Bienestar Animal al 100% de sus proveedores de su marca Alcampo Producción Controlada, que amplían al 100% de los de marca propia para 2025. Además, en 2022 según afirma la cadena, ""el 100% de explotaciones ganaderas de proveedores de Alcampo Producción Controlada de alimentos de origen animal, se habrán adherido a los compromisos publicados oficialmente en el Plan Nacional de Resistencias de Antibióticos. Luis Leyton[https://wikirate.org/Luis_Leyton].....2021-02-27 21:04:19 UTC",
https://wikirate.org/~6959565,Research Group Eticonsum+Target of Animal Welfare requirements for all products and species in 2025,Alcampo S.A.,2020,Yes,https://wikirate.org/~6948566,6959565,https://www.alcampocorporativo.es/wp-content/uploads/sites/7/2019/09/POLITICA_BIENESTAR-ANIMAL_0920.pdf,1,"La compañía declara que ""además de la exigencia del cumplimiento de la legislación vigente, Auchan Retail España ha diseñado un protocolo con los requisitos que deben cumplir sus proveedores de marcas propias o productos exclusivos de Alcampo. Deberán contar con las medidas preventivas y de control adecuadas para preservar el bienestar animal en toda la cadena de producción, que incluye la cría, el ordeño, la puesta, el transporte y el sacrificio."" Según afirma la cadena :""Se exigirá, auditará y verificará que los proveedores disponen de programas cuyo objetivo sea garantizar: - La disponibilidad constante de agua y comida adecuada para los animales. - El confort térmico. - El correcto comportamiento de la especie según su edad, especie y sexo. - El no hacinamiento, la libertad de movimiento y el espacio suficiente y adecuado para el descanso. - La ausencia de dolor, miedo o sufrimiento de los animales. - El respeto a sus ciclos vitales. - La higiene adecuada de las instalaciones y de los animales. - La au...",
https://wikirate.org/~6959575,Research Group Eticonsum+Animal welfare requirements in some products and species,Alcampo S.A.,2020,Yes,https://wikirate.org/~6948566,6959575,https://www.alcampocorporativo.es/wp-content/uploads/sites/7/2019/09/POLITICA_BIENESTAR-ANIMAL_0920.pdf,1,"En 2014, según afirma la compañía, Auchan Retail Francia definió el bienestar animal como una de las principales luchas del circuito Auchan producción controlada responsable. Hoy en día, la empresa está reforzando sus compromisos mediante una política animal sostenible y evolutiva para sus productos Auchan producción controlada responsable y sus productos de marca propia. Esta política se basa en las 5 libertades del animal: 1. no sufrir hambre o sed; 2. no sufrir falta de comodidad; 3. no sufrir dolor, lesiones o enfermedades; 4. poder expresar los comportamientos naturales de la especie; 5. no experimentar miedo o distrés. Auchan Retail Francia firmó el acuerdo Better Chicken Commitment para que el 100% de la carne de pollo utilizada en la oferta de la marca Auchan tenga en cuenta, a más tardar en 2026, estos criterios de bienestar animal más exigentes. Esta iniciativa, apoyada por unas treinta ONGs en Europa, tiene por objetivo mejorar considerablemente las condiciones de cría y sacrificio de los pollos...",
https://wikirate.org/~6959580,Research Group Eticonsum+Responsible use of antibiotics,Alcampo S.A.,2020,Yes,https://wikirate.org/~6948566,6959580,https://www.alcampocorporativo.es/wp-content/uploads/sites/7/2019/09/POLITICA_BIENESTAR-ANIMAL_0920.pdf,1,"Según afirma la compañía, ""en 2019 se han dado pasos en pro de la reducción del uso de pesticidas y de antibióticos y de la mejora del bienestar animal, poniendo en el mercado el primer producto certificado en este aspecto. A través de su Politica de Bienestar Animal, Auchan Retail España declara ""apostar por el uso responsable de antibióticos en las explotaciones ganaderas y acuícolas de sus proveedores, promoviendo medidas preventivas que reduzcan la utilización de medicamentos para el tratamiento de enfermedades infecciosas y siempre bajo supervisión veterinaria."" Dentro de estas medidas, se controla y controlará que los proveedores dispongan de un correcto programa de vacunación, que apliquen las adecuadas medidas de higiene, bioseguridad y manejo de los animales y que además, se adhieran a los compromisos publicados en el Plan Nacional de Resistencias de Antibióticos del Ministerio de Sanidad, Consumo y Bienestar Social. Por otra parte, la cadena segura que ""para 2022, el 100% de explotaciones ganader...",
https://wikirate.org/~6959600,"Research Group Eticonsum+Goal of elimination of ""cage eggs"" in 2025",Alcampo S.A.,2020,Yes,https://wikirate.org/~6948566,6959600,https://www.alcampocorporativo.es/wp-content/uploads/sites/7/2019/09/POLITICA_BIENESTAR-ANIMAL_0920.pdf,1,"Auchan Retail España comunica que ""dio los primeros pasos en su Política de Bienestar Animal, asumiendo el compromiso de comercializar a partir de 2021 huevos de su marca propia que no procedan de gallinas en jaulas, condición a aplicar para el 100% de proveedores a partir de 2025."" Según afirma la compañía, ""en los países en que la dinámica se comparte entre productores, distribuidores, asociaciones y clientes, la empresa se ha comprometido, a partir de 2016, a vender únicamente huevos “cage-free” para las referencias de su marca (MDD). En los países de la Unión Europea, se tiene que realizar este cambio completo antes de 2025. En los países que presentan un contexto agrícola o industrial aún alejado de esta temática, Auchan Retail ha tomado la decisión pragmática de entablar un debate virtuoso con los avicultores y las ONGs de cada país. El objetivo es asistirles en este enfoque y sustituir progresivamente, en un plazo voluntario y realista (por lo tanto, diferente según el país), los huevos de la cría i...",
https://wikirate.org/~6959610,"Research Group Eticonsum+Elimination of own brand ""cage eggs"" in 2023",Alcampo S.A.,2020,Yes,https://wikirate.org/~6948566,6959610,https://www.alcampocorporativo.es/wp-content/uploads/sites/7/2019/09/POLITICA_BIENESTAR-ANIMAL_0920.pdf,1,"Auchan Retail España comunica que ""dio los primeros pasos en su Política de Bienestar Animal, asumiendo el compromiso de comercializar a partir de 2021 huevos de su marca propia que no procedan de gallinas en jaulas, condición a aplicar para el 100% de proveedores a partir de 2025."" Según afirma la compañía, ""en los países en que la dinámica se comparte entre productores, distribuidores, asociaciones y clientes, la empresa se ha comprometido, a partir de 2016, a vender únicamente huevos “cage-free” para las referencias de su marca (MDD). En los países de la Unión Europea, se tiene que realizar este cambio completo antes de 2025. En los países que presentan un contexto agrícola o industrial aún alejado de esta temática, Auchan Retail ha tomado la decisión pragmática de entablar un debate virtuoso con los avicultores y las ONGs de cada país. El objetivo es asistirles en este enfoque y sustituir progresivamente, en un plazo voluntario y realista (por lo tanto, diferente según el país), los huevos de la cría i...",
https://wikirate.org/~6959635,Research Group Eticonsum+Own range of organic products of animal origin,Alcampo S.A.,2020,Yes,https://wikirate.org/~6948566,6959635,https://www.alcampocorporativo.es/wp-content/uploads/sites/7/2019/09/POLITICA_BIENESTAR-ANIMAL_0920.pdf,1,"Entre su surtido cárnico, destaca su ternera ecológica Auchan Produccion Controlada, como comprobamos en su informe. Luis Leyton[https://wikirate.org/Luis_Leyton].....2021-02-27 21:04:29 UTC",
https://wikirate.org/~6955837,Research Group Eticonsum+Own range of organic products of animal origin,El Corte Ingles S.A.,2020,Yes,https://wikirate.org/~6948978,6955837,,1,"No hemos encontrado información con respecto a esta materia en ningún informe de la compañía, sin embargo hemos comprobado que comercializa gamas de productos cárnicos bio de marca propia en su tienda online y en la base de datos Openfactfood. Un de sus productos son las hamburguesas BIO ECI. Luis Leyton[https://wikirate.org/Luis_Leyton].....2021-02-27 20:56:59 UTC",ES05051138V2;ES05051138W0
https://wikirate.org/~6955842,Research Group Eticonsum+Own range of vegetarian or vegan products,El Corte Ingles S.A.,2020,Yes,https://wikirate.org/~6948978,6955842,,1,"No hemos encontrado información con respecto a esta materia en ningún informe de la compañía, sin embargo hemos comprobado que comercializa gamas de productos vegetarianos de marca propia en su tienda online y en la base de datos Openfactfood. Un de sus productos son las hamburguesas vegearianas BIO dentro de su línea de productos Special Line. Luis Leyton[https://wikirate.org/Luis_Leyton].....2021-02-27 20:57:00 UTC",ES05051138V2;ES05051138W0
https://wikirate.org/~6953858,Research Group Eticonsum+Policy on Animal Welfare,Lidl Stiftung & Co. KG,2020,Yes,https://wikirate.org/~6948465,6953858,https://empresa.lidl.es/sostenibilidad/politica-de-compras-responsable,1,"Lidl desarrolla las actuaciones y compromisos más ambiciosos en materia de bienestar animal de todas las 8 compañias evaluadas hasta finales de 2020. Es especialmente destacable sus esfuerzos en certificar todos sus productos frescos de origen animal con los estandares de referencia y más exigentes del mercado . Todo ello sin incrementar los precios de los productos, según comunica la compañía: "" Este valor añadido sobre el bienestar animal que ofrecemos en nuestros productos no se ve reflejado en ninguna subida de precios, por lo que el consumidor final consume carne fresca y de calidad, sin necesidad de pagar más por ello. Lidl publica un documento individual con su Política de Bienestar Animal. En él detalla sus actuaciones y compromisos en relacion al abastecimiento de huevos, leche y carne frescca Luis Leyton[https://wikirate.org/Luis_Leyton].....2021-02-27 20:53:20 UTC",
https://wikirate.org/~6953863,Research Group Eticonsum+Animal welfare requirements for all products and species,Lidl Stiftung & Co. KG,2020,Yes,https://wikirate.org/~6948465,6953863,https://empresa.lidl.es/sostenibilidad/politica-de-compras-responsable,1,"Lidl aplica una política de exigencias en Bienestar Animal a todos sus productos frescos de origen animal: huevos, carne Bio ( toda la carne fresca para 2020), conejo, pollo y leche con una doble acreditación : la certificación Bienestar Animal otorgada por AENOR y el certificado Welfare Quality. Así lo comunica la compañía : ""Acreditamos nuestro compromiso de buenas prácticas animales con el sello “Bienestar Animal” certificado por AENOR, empresa líder en España en evaluación de la conformidad (certificación, verificación, validación, inspección y ensayos). Este certificado acredita que las explotaciones ganaderas y mataderos cumplen una serie de condiciones para asegurar el bienestar animal. Por otra parte, no nos conformamos y hemos obteniendo el certificado Welfare Quality® que va más allá en lo que a la supervisión de condiciones de vida del animal se refiere, pues en sus auditorías se fijan principalmente en el estado del propio animal, basado en estos cuatro principios: 1. Buena alimentación - Ausen...",
https://wikirate.org/~6953868,Research Group Eticonsum+Target of Animal Welfare requirements for all products and species in 2025,Lidl Stiftung & Co. KG,2020,Yes,https://wikirate.org/~6948465,6953868,https://empresa.lidl.es/sostenibilidad/politica-de-compras-responsable,1,"Lidl aplica una política de exigencias en Bienestar Animal a todos sus productos frescos de origen animal: huevos, carne Bio ( toda la carne fresca para 2020), conejo, pollo y leche con una doble acreditación : la certificación Bienestar Animal otorgada por AENOR y el certificado Welfare Quality. Así lo comunica la compañía : ""Acreditamos nuestro compromiso de buenas prácticas animales con el sello “Bienestar Animal” certificado por AENOR, empresa líder en España en evaluación de la conformidad (certificación, verificación, validación, inspección y ensayos). Este certificado acredita que las explotaciones ganaderas y mataderos cumplen una serie de condiciones para asegurar el bienestar animal. Por otra parte, no nos conformamos y hemos obteniendo el certificado Welfare Quality® que va más allá en lo que a la supervisión de condiciones de vida del animal se refiere, pues en sus auditorías se fijan principalmente en el estado del propio animal, basado en estos cuatro principios: 1. Buena alimentación - Ausen...",
https://wikirate.org/~6953873,Research Group Eticonsum+Animal welfare requirements for 50% of the products and species,Lidl Stiftung & Co. KG,2020,Yes,https://wikirate.org/~6948465,6953873,https://empresa.lidl.es/sostenibilidad/politica-de-compras-responsable,1,"Lidl aplica una política de exigencias en Bienestar Animal a todos sus productos frescos de origen animal: huevos, carne Bio ( toda la carne fresca para 2020), conejo, pollo y leche con una doble acreditación : la certificación Bienestar Animal otorgada por AENOR y el certificado Welfare Quality. Así lo comunica la compañía : ""Acreditamos nuestro compromiso de buenas prácticas animales con el sello “Bienestar Animal” certificado por AENOR, empresa líder en España en evaluación de la conformidad (certificación, verificación, validación, inspección y ensayos). Este certificado acredita que las explotaciones ganaderas y mataderos cumplen una serie de condiciones para asegurar el bienestar animal. Por otra parte, no nos conformamos y hemos obteniendo el certificado Welfare Quality® que va más allá en lo que a la supervisión de condiciones de vida del animal se refiere, pues en sus auditorías se fijan principalmente en el estado del propio animal, basado en estos cuatro principios: 1. Buena alimentación - Ausen...",
https://wikirate.org/~6953878,Research Group Eticonsum+Animal welfare requirements in some products and species,Lidl Stiftung & Co. KG,2020,Yes,https://wikirate.org/~6948465,6953878,https://empresa.lidl.es/sostenibilidad/politica-de-compras-responsable,1,"Lidl aplica una política de exigencias en Bienestar Animal a todos sus productos frescos de origen animal: huevos, carne Bio ( toda la carne fresca para 2020), conejo, pollo y leche con una doble acreditación : la certificación Bienestar Animal otorgada por AENOR y el certificado Welfare Quality. Así lo comunica la compañía : ""Acreditamos nuestro compromiso de buenas prácticas animales con el sello “Bienestar Animal” certificado por AENOR, empresa líder en España en evaluación de la conformidad (certificación, verificación, validación, inspección y ensayos). Este certificado acredita que las explotaciones ganaderas y mataderos cumplen una serie de condiciones para asegurar el bienestar animal. Por otra parte, no nos conformamos y hemos obteniendo el certificado Welfare Quality® que va más allá en lo que a la supervisión de condiciones de vida del animal se refiere, pues en sus auditorías se fijan principalmente en el estado del propio animal, basado en estos cuatro principios: 1. Buena alimentación - Ausen...",
https://wikirate.org/~6953898,"Research Group Eticonsum+Elimination of ""cage eggs""",Lidl Stiftung & Co. KG,2020,Yes,https://wikirate.org/~6948465,6953898,https://empresa.lidl.es/sostenibilidad/politica-de-compras-responsable,1,"Según se puede comprobar en varios artículos, a principios de 2018, Lidl se convertía en el primer supermercado en España en dejar de vender huevos procedentes de gallinas enjauladas, lo que significa ( clasificación 3 que acredita que proceden de gallinas de jaula). La cadena se queda, por tanto, con tres códigos: 2 (gallinas criadas en el suelo), 1 (gallinas camperas), y 0 (gallinas ecológicas). Esta política la confirman en su Informe Bienestar Animal, en el que comunican que desde el 1 de enero de 2018 Lidl ya no vende huevos frescos de gallinas enjauladas (categoría 3), adelantamos según la compañía en 7 años al consenso del mercado que pretendía llegar a este objetivo en 2025 Luis Leyton[https://wikirate.org/Luis_Leyton].....2021-02-27 20:53:24 UTC",
https://wikirate.org/~6953903,"Research Group Eticonsum+Goal of elimination of ""cage eggs"" in 2025",Lidl Stiftung & Co. KG,2020,Yes,https://wikirate.org/~6948465,6953903,https://empresa.lidl.es/sostenibilidad/politica-de-compras-responsable,1,"Según se puede comprobar en varios artículos, a principios de 2018, Lidl se convertía en el primer supermercado en España en dejar de vender huevos procedentes de gallinas enjauladas, lo que significa ( clasificación 3 que acredita que proceden de gallinas de jaula). La cadena se queda, por tanto, con tres códigos: 2 (gallinas criadas en el suelo), 1 (gallinas camperas), y 0 (gallinas ecológicas). Esta política la confirman en su Informe Bienestar Animal, en el que comunican que desde el 1 de enero de 2018 Lidl ya no vende huevos frescos de gallinas enjauladas (categoría 3), adelantamos según la compañía en 7 años al consenso del mercado que pretendía llegar a este objetivo en 2025 Luis Leyton[https://wikirate.org/Luis_Leyton].....2021-02-27 20:53:24 UTC",
https://wikirate.org/~6953908,"Research Group Eticonsum+Elimination of own brand ""cage eggs""",Lidl Stiftung & Co. KG,2020,Yes,https://wikirate.org/~6948465,6953908,https://empresa.lidl.es/sostenibilidad/politica-de-compras-responsable,1,"Según se puede comprobar en varios artículos, a principios de 2018, Lidl se convertía en el primer supermercado en España en dejar de vender huevos procedentes de gallinas enjauladas, lo que significa ( clasificación 3 que acredita que proceden de gallinas de jaula). La cadena se queda, por tanto, con tres códigos: 2 (gallinas criadas en el suelo), 1 (gallinas camperas), y 0 (gallinas ecológicas). Esta política la confirman en su Informe Bienestar Animal, en el que comunican que desde el 1 de enero de 2018 Lidl ya no vende huevos frescos de gallinas enjauladas (categoría 3), adelantamos según la compañía en 7 años al consenso del mercado que pretendía llegar a este objetivo en 2025 Luis Leyton[https://wikirate.org/Luis_Leyton].....2021-02-27 20:53:25 UTC",
